{
  "decision_id": "decision-0010",
  "title": "Core, provider, repository, and application boundaries are explicit",
  "status": "accepted",
  "iteration": 1,
  "context": "During implementation, responsibility drift between the core tool, providers, repository configuration, and the application layer is a common failure mode. Explicit boundary definitions are needed to prevent this.",
  "decision": "The system defines four responsibility layers: core tool, provider, repository configuration, and application/runtime. Each layer has clearly defined responsibilities and non-responsibilities. The core tool operates at the business-model level. Providers operate at the technology-integration level. Repository configuration operates as a business declaration surface. The application/runtime operates at the execution level.",
  "alternatives": [
    "Define boundaries informally through code review rather than an explicit decision.",
    "Merge the core and provider layers into a single implementation boundary.",
    "Allow responsibilities to emerge organically from implementation needs."
  ],
  "rationale": "Explicit responsibility boundaries prevent responsibility drift and reduce ambiguity during implementation. They also provide a clear structure for behavior-first development and ensure that coding agents and human developers operate within well-defined constraints.",
  "consequences": [
    "Implementation work must respect the defined boundaries.",
    "No layer may assume responsibilities assigned to another.",
    "Provider loading, configuration parsing, and runtime orchestration remain outside the scope of the business boundary and will be addressed at the implementation level."
  ],
  "reversal_trigger": "If a specific boundary proves impractical during implementation (for example, a responsibility that genuinely spans two layers without a clean seam), the affected boundary may be adjusted with a new governing decision record.",
  "source_ids": ["src-multiverse-old-reference"],
  "linked_rubric_dimensions": [
    "architecture_boundary_integrity",
    "provider_contract_stability",
    "business_truth_alignment"
  ]
}
